Maine 2025 Priority Bills,Stance,Issues,Status Text,Future Hearing Dates,Last Timeline Action,Source Link,AI Summary,Sponsors List,Cosponsors List
"L.D. 946 (H.P. 611): Resolve, to Increase Access to Energy Efficiency Programs by Low-income and Moderate-income Residents",Support,,Enacted,,Final Disposition: Finally Passed,https://legislature.maine.gov/billtracker/#Paper/HP0611?legislature=132,"This legislative amendment to L.D. 946 directs the Efficiency Maine Trust to allocate at least 50% of all available funding for electric vehicle rebates and for incentives related to weatherization and heat pumps to low-income and moderate-income residents during the period covered by the Trust's 6th triennial plan, as outlined in Maine Revised Statutes, Title 35-A, section 10104, subsection 4. The amendment replaces the original resolve, focusing specifically on ensuring equitable access to energy efficiency programs and clean transportation incentives for economically disadvantaged populations. No specific funding figures are provided in the text, but the requirement applies to all funds available for these programs during the specified planning period. The amendment does not introduce new deadlines beyond the timeframe of the 6th triennial plan, nor does it alter the underlying statutes except to specify the distribution requirements for these funds. This measure aligns with efforts to promote energy equity and support the participation of low- and moderate-income households in Maine’s transition to cleaner energy and transportation solutions.",ME Rep. Sophia Warren (D-ME-124),"ME Rep. Daniel ""Dan"" Ankeles (D-ME-100), ME Rep. Cheryl Golek (D-ME-099), ME Sen. Rachel Talbot Ross (D-ME-028), ME Sen. Mike ""Michael"" Tipping (D-ME-008)"
L.D. 1158 (H.P. 763): An Act to Expand Appliance Energy and Water Standards ,Support,,Enacted,,Governor Action: Unsigned,https://legislature.maine.gov/billtracker/#Paper/1158?legislature=132,"This legislation amends Maine's appliance energy and water standards by expanding the list of appliances and products subject to state efficiency regulations. Beginning January 1, 2027, the sale or offering for sale of certain newly manufactured appliances—including commercial battery chargers, commercial dishwashers, commercial food steamers, commercial fryers, commercial ovens, computer server power supplies, and residential ventilating fans—will be prohibited in Maine if they are banned under rules adopted by the Department of Environmental Protection. The law clarifies that these restrictions do not apply to products manufactured before January 1, 2027, or to used products, and provides exemptions if federal law preempts state regulation. The Department is authorized to adopt major substantive rules to enforce these standards, and violations may result in civil fines of up to $100. These changes align with efforts to improve energy and water efficiency, reduce environmental impact, and ensure consistency with other states' regulations.","ME Rep. Arthur ""Art"" Bell (D-ME-103)","ME Rep. William ""Bill"" Bridgeo (D-ME-060), ME Rep. Victoria ""Vicki"" Doudera (D-ME-041), ME Rep. Laurie Osher (D-ME-025), ME Rep. William ""Bill"" Pluecker (I-ME-044), ME Sen. Denise Tepler (D-ME-024)"
"L.D. 356 (S.P. 142): Resolve, Directing the Board of Pesticides Control to Prohibit the Use of Rodenticides in Outdoor Residential Settings",Support,,Enacted,,Final Disposition: Finally Passed,https://legislature.maine.gov/billtracker/#Paper/SP0142?legislature=132,"This legislative amendment to L.D. 356, as adopted by the Maine Senate's Committee on Agriculture, Conservation and Forestry, replaces the original bill with a resolve that directs the Department of Agriculture, Conservation and Forestry's Board of Pesticides Control to prohibit the use of rodenticides, including rodenticidal baits, in outdoor residential settings. The prohibition does not apply to certified applicators, as defined by Maine Revised Statutes, Title 22, section 1471-C, subsection 4, who are authorized to use or supervise the use of pesticides. The Board is required to submit a report updating the status of this prohibition to the Joint Standing Committee on Agriculture, Conservation and Forestry by January 15, 2026. The committee is granted the authority to submit related legislation in the subsequent legislative session based on the report's findings. The amendment also removes the emergency preamble and clause from the original bill. This action aligns with the organization's mission to promote environmental safety and public health by restricting the use of potentially harmful chemicals in residential outdoor environments, while still allowing for professional pest management where necessary.",ME Sen. Rick Bennett (R-ME-018),"ME Rep. Arthur ""Art"" Bell (D-ME-103), ME Rep. Marygrace Cimino (R-ME-083), ME Rep. Victoria ""Vicki"" Doudera (D-ME-041), ME Rep. John Eder (R-ME-136), ME Sen. Nicole Grohoski (D-ME-007), ME Rep. Nina Milliken (D-ME-016)"
L.D. 441 (H.P. 295): An Act to Allow the Investment of Money Deposited with the Treasurer of State for the Maine Deer Management Fund ,Support,,Passed Original Chamber,,"Carried Over, In The Same Posture, To Any Special Or Regular Session Of The 132Nd Legislature, Pursuant To Joint Order Sp 800.",https://legislature.maine.gov/billtracker/#Paper/441?legislature=132,"This legislative amendment to H.P. 295, L.D. 441, retitles the bill and replaces its original content to specifically address the management of the Maine Deer Management Fund. The amendment authorizes that money deposited with the Treasurer of State for the Maine Deer Management Fund may be invested according to existing legal provisions, and stipulates that any income generated from these investments must be credited back to the fund. The amendment maintains existing allocations of deer registration and antlerless deer permit fees for landowner assistance, predator control, and deer habitat management, and continues to allow the acceptance of monetary gifts and donations. The Department of Inland Fisheries and Wildlife is still required to report annually to the Legislature on the fund’s status and use. No new funding amounts or deadlines are introduced, but the amendment enhances the fund’s financial management by allowing investment of its assets, potentially increasing resources available for deer management and related conservation efforts.",ME Rep. Tiffany Roberts (D-ME-149),
"L.D. 402 (H.P. 256): An Act to Move the Natural Areas Program from the Department of Agriculture, Conservation and Forestry to the Department of Inland Fisheries and Wildlife and to Amend the Law Governing Administration of the Bureau of Resource Management Within the Department of Inland Fisheries and Wildlife",Support,,Passed Original Chamber,,Final Disposition: Died Between Houses,https://legislature.maine.gov/billtracker/#Paper/HP0256?legislature=132,"This legislative amendment to L.D. 402 concerns the transfer of Maine's Natural Areas Program from the Department of Agriculture, Conservation and Forestry (DACF) to the Department of Inland Fisheries and Wildlife (DIFW). The amendment makes several technical corrections to the original bill, including clarifying departmental references and relettering sections for consistency. A significant policy change introduced by the amendment is the restriction placed on the Commissioner of Inland Fisheries and Wildlife, who is now prohibited from adopting rules to protect plants under the relevant subchapter unless such action is necessary for the conservation of rare, threatened, or endangered fish or wildlife. This narrows the scope of plant protection to cases directly impacting animal conservation, potentially limiting broader plant conservation efforts. Additionally, the amendment removes a provision that would have required a duplicative consistency review of comprehensive municipal growth management plans by the DIFW, streamlining administrative processes and avoiding redundancy.

The amendment mandates that by January 15, 2027, the DIFW must submit a report to the Legislature's relevant committees detailing the outcomes, findings, and recommendations regarding the transfer of the Natural Areas Program. This report may inform future legislative action, as the committees are authorized to propose related legislation to the 133rd Legislature in 2027. This timeline ensures legislative oversight and the opportunity for further adjustments based on the program's performance post-transfer.

In terms of funding, the amendment details the transfer of personnel and associated funds from the DACF to the DIFW. Specifically, it reallocates one Public Service Manager II, one Resource Management Coordinator, and five Biologist II positions, along with their respective funding streams, from the DACF's Natural Areas Program to the DIFW's Resource Management Services. The financial adjustments for fiscal years 2025-26 and 2026-27 are outlined, with reductions in the DACF's budget and corresponding increases in the DIFW's budget across the General Fund, Federal Expenditures Fund, and Other Special Revenue Funds. The amendment also establishes a baseline allocation for the Natural Areas Conservation Fund within the DIFW.

Key points relevant to conservation and natural resource management include the administrative realignment of the Natural Areas Program, the narrowed regulatory authority over plant protection, and the requirement for legislative review of the program's transfer. These changes align with the organization's mission if it is focused on efficient government operations and the integration of wildlife and natural area management, but may raise concerns for those prioritizing comprehensive plant conservation, as the amendment limits regulatory protections for plants unless tied to animal conservation needs.

Overall, the amendment seeks to streamline the administration of Maine's natural areas by consolidating programs under the DIFW, clarifies regulatory authority, and ensures legislative oversight, while also making significant changes to the scope of plant protection and the allocation of state resources.","ME Rep. James ""Jim"" Dill (D-ME-026)",
"L.D. 65 (H.P. 29): An Act to Update the Definition of ""Coastal Wetlands"" Under the Natural Resources Protection Act and the Mandatory Shoreland Zoning Laws",Support,"Climate Change: Prevention & Reaction, Coastal Protection",Enacted,,Final Disposition: Enacted,https://legislature.maine.gov/billtracker/#Paper/HP0029?legislature=132,"This legislative amendment to H.P. 29, L.D. 65, titled 'An Act to Update the Definition of ""Coastal Wetlands"" Under the Natural Resources Protection Act and the Mandatory Shoreland Zoning Laws,' revises and standardizes the definition of 'coastal wetlands' in Maine law. Specifically, it repeals and replaces the existing definitions in both the Natural Resources Protection Act (38 MRSA §480-B, sub-§2) and the mandatory shoreland zoning laws (38 MRSA §436-A, sub-§1). The new definition clarifies that 'coastal wetlands' include all areas with salt-tolerant vegetation found primarily in saltwater or estuarine habitats, as well as all tidal and subtidal lands, swamps, marshes, bogs, beaches, flats, or other contiguous lowlands subject to tidal action during the highest astronomical tide, as determined by the National Oceanic and Atmospheric Administration. The definition also allows for the inclusion of portions of coastal sand dunes as coastal wetlands. No specific funding allocations or deadlines are mentioned in the amendment. The primary impact of this legislation is to provide a more precise and consistent legal framework for identifying and regulating coastal wetlands, which is directly relevant to organizations focused on environmental protection, coastal management, and habitat conservation. By updating and harmonizing these definitions, the amendment aims to improve the effectiveness of natural resource protection and shoreland zoning efforts in Maine.","ME Rep. Victoria ""Vicki"" Doudera (D-ME-041)",
L.D. 228 (H.P. 151): An Act to Allow Coastal Seawalls to Be Raised by up to 2 Feet in Order to Accommodate Predicted Sea Level Rise,Support,,Enacted,,Final Disposition: Emergency Enacted,https://legislature.maine.gov/billtracker/#Paper/HP0151?legislature=132,"This legislative amendment to Maine's Natural Resources Protection Act authorizes the Department of Environmental Protection to permit a one-time increase of up to two feet in the height of existing seawalls or similar structures located within coastal sand dune systems, provided that a series of specific conditions are met. The amendment defines 'existing seawall' as one that legally existed as of January 1, 2025, and sets eligibility criteria based on the size and use of the property (residential, commercial, or road), proximity of structures to the seawall, and the absence or impracticality of restoring a seaward sand dune. The increased height must not exceed one foot above the base flood elevation, and the seawall's other dimensions cannot be altered. Applicants are required to mitigate any increased erosion or scouring caused by the height increase, and, where space allows, must construct or plant native dune vegetation landward of the seawall. For projects involving multiple contiguous lots, the amendment stipulates that the cumulative effect of seawall height increases must not exacerbate flood risks to neighboring properties as determined by engineering analysis. The amendment also clarifies that certain stabilization materials and construction methods are permissible when used in conjunction with existing seawalls, and it allows for the use of metal stakes, anchors, or cables in these contexts under a permit by rule. Additionally, the bill modifies existing law to permit the replacement of seawalls destroyed or threatened by emergencies to be rebuilt with an increased height, in line with the new provisions. These changes are designed to address predicted sea level rise while balancing environmental protection, property rights, and community resilience. The amendment does not specify new funding allocations or deadlines but focuses on regulatory changes and permitting criteria.","ME Rep. Robert ""Bob"" Foley (R-ME-145)","ME Rep. Richard ""Dick"" Campbell (R-ME-019), ME Rep. Lori Gramlich (D-ME-131), ME Sen. Joseph ""Joe"" Martin (R-ME-019), ME Rep. Richard ""Rick"" Mason (R-ME-097), ME Rep. Michael ""Mike"" Soboleski (R-ME-073), ME Sen. Donna Bailey (D-ME-031), ME Rep. Mark Blier (R-ME-138)"
"L.D. 300 (H.P. 200): Resolve, to Direct the Governor's Energy Office to Study Expanding the Use of Hydroelectric Power and the Development of a Geothermal Power Plant in the State ",Watching,,Enacted,,Governor Action: Signed,https://legislature.maine.gov/billtracker/#Paper/300?legislature=132,"This legislative resolve directs the Governor's Energy Office of Maine to conduct comprehensive studies on expanding hydroelectric power and developing geothermal energy systems within the state. The office is tasked with reviewing current hydroelectric operations, exploring opportunities for expansion and energy storage, and evaluating new technologies used in other states, particularly by consulting with facilities in Alaska and two other comparable states. The study will also identify suitable locations for pumped storage hydropower systems and assess barriers to their implementation. Additionally, the office will evaluate the feasibility of developing geothermal power plants and district geothermal systems, especially on brownfield sites and state-owned properties, in consultation with geological experts and relevant state and federal agencies. The studies are to consider greenhouse gas emissions associated with these energy sources. The office must submit its findings and any recommendations to the Legislature's energy committee by January 15, 2027, which may then propose related legislation. No specific funding allocations are mentioned, and the resolve does not amend existing statutes but establishes new directives for energy research and planning.",ME Rep. Mathew McIntyre (R-ME-018),ME Rep. Alicia Collins (R-ME-061)
"L.D. 1420 (S.P. 576): Resolve, to Establish the Commission to Ensure a Just and Equitable Energy Transition for Maine's Workforce",Support,,Passed Original Chamber,,"Carried Over, In The Same Posture, To Any Special Or Regular Session Of The 132Nd Legislature, Pursuant To Joint Order Sp 800.",https://legislature.maine.gov/billtracker/#Paper/SP0576?legislature=132,"This Senate amendment to Committee Amendment 'A' for L.D. 1420, 'Resolve, to Establish the Commission to Ensure a Just and Equitable Energy Transition for Maine's Workforce,' makes several procedural changes to the underlying amendment. Specifically, it removes the emergency preamble and the emergency clause, which would have allowed the legislation to take effect immediately upon passage. Additionally, it strikes out certain instructional paragraphs and ensures that any nonconsecutive part letters or section numbers are renumbered for consistency. The amendment does not alter the substantive provisions regarding the establishment or operation of the commission itself, nor does it affect any funding or core mandates related to the commission's work on Maine's energy transition and workforce. These changes are primarily technical and procedural, focusing on the legislative process rather than the policy content of the bill. The amendment aligns with the organization's mission only insofar as it affects the timing and procedural aspects of the commission's establishment, not its substantive goals or operations.",ME Sen. Mark Lawrence (D-ME-035),"ME Rep. Valli Geiger (D-ME-042), ME Rep. Christopher Kessler (D-ME-121), ME Sen. Mike ""Michael"" Tipping (D-ME-008)"
L.D. 343 (H.P. 243): An Act to Direct the Public Utilities Commission to Seek Informational Bids Regarding Small Modular Nuclear Reactors in the State,Oppose,,Introduced or Prefiled,,"Carried Over, In The Same Posture, To Any Special Or Regular Session Of The 132Nd Legislature, Pursuant To Joint Order Sp 800.",https://legislature.maine.gov/billtracker/#Paper/HP0243?legislature=132,"This legislative amendment to L.D. 343, as proposed in the Maine House of Representatives, replaces the original bill and retitles it as 'An Act to Ensure Periodic Assessment for Clean Energy Technology.' The amendment modifies existing law (2 MRSA §9, sub-§3, ¶C) by requiring the Director of the Governor's Energy Office to include, in the biennial update to the state's comprehensive energy plan, a new section that reviews and evaluates emerging energy technologies. This evaluation must specifically address technologies that could help Maine achieve its greenhouse gas emissions reduction goals as established under Title 38, Section 576-A. The technologies to be reviewed include, but are not limited to, energy storage solutions and small modular nuclear reactors. The amendment does not allocate specific funding or set new deadlines beyond the biennial reporting cycle already in place. The key point of this amendment is its focus on ensuring that Maine's energy planning process systematically considers innovative and potentially impactful clean energy technologies, aligning with broader state objectives to reduce greenhouse gas emissions. This approach supports the organization's mission if it is centered on advancing clean energy, climate action, or the integration of new technologies into the state's energy portfolio.",ME Rep. Reagan Paul (R-ME-037),"ME Rep. Roger Albert (R-ME-002), ME Rep. Richard ""Dick"" Campbell (R-ME-019), ME Rep. Gary Drinkwater (R-ME-027), ME Rep. Steven Foster (R-ME-032), ME Sen. Matt Harrington (R-ME-033), ME Rep. Benjamin ""Ben"" Hymes (R-ME-038), ME Rep. Mathew McIntyre (R-ME-018), ME Rep. Michael ""Mike"" Soboleski (R-ME-073)"
L.D. 115 (S.P. 15): An Act to Assess Impact Fees on Megayachts ,Support,,Introduced or Prefiled,,"Accepted Majority (Ontp) Report,",https://legislature.maine.gov/billtracker/#Paper/115?legislature=132,"The legislative text pertains to an amendment to a bill titled 'An Act to Assess Impact Fees on Megayachts' in the State of Maine. The amendment introduces a fiscal note and establishes the Megayacht Fund with baseline allocations of $500 for the fiscal years 2025-26 and 2026-27. The amendment clarifies that the collection of impact fees may require local governments to expand or modify activities, potentially leading to additional local expenditures. However, the minority of the committee believes that this does not constitute a mandate, as many municipalities already collect similar fees and the legislation does not require new infrastructure. The impact fees collected are proposed to be distributed equally between supporting harbor and sea level rise mitigation infrastructure and public transit infrastructure, which can help offset any costs incurred by municipalities. The amendment aims to ensure that municipalities can manage the implementation of impact fees within their existing resources without additional mandates.",ME Sen. Rick Bennett (R-ME-018),ME Rep. Grayson Lookner (D-ME-113)
L.D. 317 (H.P. 217): An Act to Enact the Safe Cosmetics Act,Support,Toxics,Enacted,,"Carried Over, In The Same Posture, To Any Special Or Regular Session Of The 132Nd Legislature, Pursuant To Joint Order Sp 800.",https://legislature.maine.gov/billtracker/#Paper/HP0217?legislature=132,"The committee amendment to L.D. 317, 'An Act to Enact the Safe Cosmetics Act,' introduces an appropriations and allocations section to the original bill. Specifically, it provides funding from the General Fund for the Department of Environmental Protection, allocating $206,592 for fiscal year 2025-26 and $221,750 for fiscal year 2026-27. These funds will support the creation of two new positions: one Environmental Specialist III and one Planning and Research Associate II, along with associated costs. The amendment does not alter the substantive provisions of the Safe Cosmetics Act itself but ensures that the Department has the necessary resources to implement and enforce the Act. No new deadlines or timelines are introduced in this amendment. The key point of this amendment is the provision of dedicated funding and staffing to support the Act’s objectives, which aligns with the organization's mission to ensure effective environmental protection and public health oversight.",ME Rep. Sophia Warren (D-ME-124),"ME Rep. Mana Abdi (D-ME-095), ME Sen. Mattie Daughtry (D-ME-023), ME Rep. Lori Gramlich (D-ME-131), ME Rep. Ambureen Rana (D-ME-021)"
L.D. 837 (S.P. 370): An Act to Require Positions Taken by the Public Advocate to Be Consistent with the Cost-effective Implementation of the State's Greenhouse Gas Emissions Reductions Obligations ,Support,,Enacted,,Governor Action: Unsigned,https://legislature.maine.gov/billtracker/#Paper/837?legislature=132,"This legislative act amends Section 1702, subsection 10 of Title 35-A of the Maine Revised Statutes, which outlines the responsibilities of the Public Advocate. The amendment adds a new requirement that, in addition to promoting price stabilization and adhering to established priorities, the Public Advocate must ensure that any position taken is consistent with the cost-effective implementation for ratepayers of the state's greenhouse gas emissions reductions obligations as established in Title 38, Section 576-A. This change aligns the Public Advocate's advocacy with Maine's climate goals, specifically mandating that their actions support the state's statutory greenhouse gas reduction targets in a manner that is financially prudent for ratepayers. No specific funding allocations or deadlines are mentioned in the text. The key point is the explicit integration of climate policy considerations into the Public Advocate's mandate, which directly supports organizations focused on climate action and consumer protection.",ME Sen. Mark Lawrence (D-ME-035),"ME Rep. Valli Geiger (D-ME-042), ME Rep. Walter ""Gerry"" Runte (D-ME-146), ME Rep. Melanie Sachs (D-ME-102), ME Rep. Kilton Webb (D-ME-098)"
L.D. 593 (S.P. 277): An Act to Extend Funding for the Land for Maine's Future Program,Support,,Enacted,,"Carried Over, In The Same Posture, To Any Special Or Regular Session Of The 132Nd Legislature, Pursuant To Joint Order Sp 800.",https://legislature.maine.gov/billtracker/#Paper/SP0277?legislature=132,"This legislative text pertains to an amendment to S.P. 277, L.D. 593, titled 'An Act to Extend Funding for the Land for Maine's Future Program.' The amendment specifically incorporates a fiscal note into the bill, which typically provides detailed information regarding the financial implications of the proposed legislation. While the text does not specify the exact funding amounts or allocations, the inclusion of a fiscal note suggests that the bill will have budgetary impacts related to the continued support of the Land for Maine's Future Program. No explicit changes to existing statutes or regulations are detailed in this excerpt, nor are specific timelines or deadlines mentioned. The key point of this amendment is to ensure that the financial aspects of extending the program are formally considered and documented, aligning with the organization's mission to support conservation, land preservation, and responsible fiscal planning in Maine.",ME Sen. Russell Black (R-ME-005),"ME Rep. Mark Blier (R-ME-138), ME Sen. Stacy Brenner (D-ME-030), ME Rep. Stephan Bunker (D-ME-075), ME Rep. Lydia Crafts (D-ME-046), ME Rep. James ""Jim"" Dill (D-ME-026), ME Rep. John ""Jack"" Ducharme (R-ME-071), ME Rep. Randall ""Randy"" Hall (R-ME-074), ME Rep. Richard ""Rick"" Mason (R-ME-097), ME Sen. Cameron Reny (D-ME-013)"
