Maine 2025 Priority Bills,Stance,Issues,Status Text,Future Hearing Dates,Last Timeline Action,Source Link,AI Summary,Sponsors List,Cosponsors List
L.D. 905 (S.P. 394): An Act to Clarify the Process to Transfer Funds Resulting from the Expiration of Unused Kilowatt-hour Credits to Be Used to Provide Assistance to Low-income Electricity Customers,Support,,Enacted,,Final Disposition: Enacted,https://legislature.maine.gov/billtracker/#Paper/SP0394?legislature=132,"Legislative Document No. 905, introduced in the 132nd Maine Legislature, amends the process by which unused kilowatt-hour credits from net energy billing arrangements are managed and allocated. The bill modifies 35-A MRSA §3209-A, sub-§8, by changing the recipient of the value of expired, unused kilowatt-hour credits from the Public Utilities Commission (PUC) to the administrators of the statewide low-income assistance plan and individual low-income assistance programs, as designated by the PUC through rulemaking. This adjustment ensures that the financial benefits from unused credits directly support low-income electricity customers. Additionally, the bill extends the annual deadline for utilities to remit these funds from January 1st to April 1st, providing utilities with additional time to process and transfer the credits. The legislation also introduces a new reporting requirement: utilities must now report to the PUC the number and monetary value of unused kilowatt-hour credits that expired in the previous calendar year. These changes are to be implemented through routine technical rulemaking by the PUC. The bill aligns with efforts to enhance support for low-income electricity customers by streamlining the transfer and reporting of unused net energy billing credits, thereby improving transparency and ensuring that assistance reaches those in need more efficiently.",ME Sen. Mark Lawrence (D-ME-035),
L.D. 457 (S.P. 190): An Act to Fund Climate Resiliency Projects Related to the Repair of Campus Infrastructure Used for Active Transportation and Outdoor Recreation ,Support,,Passed Original Chamber,,"Carried Over, In The Same Posture, To Any Special Or Regular Session Of The 132Nd Legislature, Pursuant To Joint Order Sp 800.",https://legislature.maine.gov/billtracker/#Paper/457?legislature=132,"The legislative text pertains to an amendment to a bill titled 'An Act to Fund Climate Resiliency Projects Related to the Repair of Campus Infrastructure Used for Active Transportation and Outdoor Recreation.' The amendment involves the incorporation of a fiscal note, which typically provides details on the financial implications of the bill. However, the specific figures or allocations related to the funding for climate resiliency projects are not detailed in the provided text. The focus of the bill is on enhancing infrastructure that supports active transportation and outdoor recreation, aligning with goals of promoting environmental sustainability and public health through improved campus facilities.",ME Sen. Anne Carney (D-ME-029),"ME Rep. Matthew Beck (D-ME-122), ME Rep. Michelle Boyer (D-ME-123), ME Rep. Deqa Dhalac (D-ME-120), ME Rep. Christopher Kessler (D-ME-121)"
"L.D. 1 (S.P. 29): An Act to Increase Storm Preparedness for Maine's Communities, Homes and Infrastructure",Support,,Enacted,,Final Disposition: Emergency Enacted,https://legislature.maine.gov/billtracker/#Paper/SP0029?legislature=132,"This legislative amendment to Maine's 'An Act to Increase Storm Preparedness for Maine's Communities, Homes and Infrastructure' establishes the State Resilience Office within the Maine Office of Community Affairs, transferring key responsibilities from the Office of Policy Innovation and the Future. The State Resilience Office is tasked with coordinating and implementing resilience policies, administering the Community Resilience Partnership Program, the floodplain management program, and the State Floodplain Mapping Fund. The bill standardizes terminology to focus on 'extreme weather events' and expands eligibility for resilience programs and funding to include county, municipal, and tribal governments. Significant funding allocations are made, including $7.5 million annually for the Home Resiliency Fund to provide grants to homeowners for storm risk reduction, and over $11 million in special revenue funds for the Department of Defense, Veterans and Emergency Management for emergency management staffing, communications upgrades, and disaster recovery. The State Resilience Fund is established as a dedicated, nonlapsing fund, with annual transfers of $1,755,000 from the Bureau of Insurance's surplus, and an initial transfer of $9,633,040 from the Department of Professional and Financial Regulation. Additional appropriations support new staff positions, the development of flood risk data tools, and regional capacity-building for floodplain management. The bill also provides for a transition period, during which existing rules, contracts, and resources are transferred to the new office, and includes a contingency that certain program transfers only occur once sufficient funding is secured. The overall aim is to enhance Maine's preparedness and resilience to extreme weather and natural hazards through improved coordination, technical assistance, financial support, and data-driven planning, aligning closely with climate adaptation and risk mitigation priorities.",ME Sen. Mattie Daughtry (D-ME-023),"ME Rep. Billy Bob Faulkingham (R-ME-012), ME Speaker Ryan Fecteau (D-ME-132)"
"L.D. 260 (H.P. 163): RESOLUTION, Proposing an Amendment to the Constitution of Maine to Establish That All Maine Residents Have Equal Rights Under the Law",Support,,Passed Original Chamber,,"Carried Over, In The Same Posture, To Any Special Or Regular Session Of The 132Nd Legislature, Pursuant To Joint Order Sp 800.",https://legislature.maine.gov/billtracker/#Paper/HP0163?legislature=132,"The legislative text refers to a committee amendment to L.D. 260, a resolution proposing an amendment to the Constitution of Maine to establish that all Maine residents have equal rights under the law. The amendment, identified as the majority report of the Judiciary Committee, specifically incorporates a fiscal note into the resolution. The fiscal note would provide an analysis of the potential financial impact of the proposed constitutional amendment, ensuring that legislators and the public are informed about any budgetary implications. No additional substantive changes to the language of the resolution or to existing statutes are indicated in this amendment. There are no specific funding allocations, deadlines, or timelines mentioned in the text provided. The key point of this amendment is the inclusion of fiscal transparency in the legislative process for a measure that seeks to enshrine equal rights for all Maine residents, which aligns with organizational missions focused on civil rights, equality, and responsible governance.",ME Rep. Holly Sargent (D-ME-147),"ME Rep. Mana Abdi (D-ME-095), ME Rep. Daniel ""Dan"" Ankeles (D-ME-100), ME Rep. Marshall Archer (D-ME-129), ME Rep. Poppy Arford (D-ME-101), ME Sen. Donna Bailey (D-ME-031), ME Sen. Joe Baldacci (D-ME-009), ME Rep. Matthew Beck (D-ME-122), ME Sen. Pinny Beebe-Center (D-ME-012), ME Rep. Arthur ""Art"" Bell (D-ME-103), ME Rep. Michelle Boyer (D-ME-123), ME Rep. Michael Brennan (D-ME-115), ME Sen. Stacy Brenner (D-ME-030), ME Rep. William ""Bill"" Bridgeo (D-ME-060), ME Rep. Stephan Bunker (D-ME-075), ME Sen. Anne Carney (D-ME-029), ME Rep. Kristen Cloutier (D-ME-094), ME Rep. Sally Cluchey (D-ME-052), ME Rep. Lynn Copeland (D-ME-130), ME Rep. Lydia Crafts (D-ME-046), ME Rep. W. Edward ""Ed"" Crockett (D-ME-112), ME Rep. Aaron Dana (?-ME-152), ME Sen. Mattie Daughtry (D-ME-023), ME Rep. Flavia DeBrito (D-ME-064), ME Rep. Deqa Dhalac (D-ME-120), ME Rep. James ""Jim"" Dill (D-ME-026), ME Rep. Janice ""Jan"" Dodge (D-ME-039), ME Rep. Victoria ""Vicki"" Doudera (D-ME-041), ME Sen. Jill Duson (D-ME-027), ME Rep. Holly Eaton (D-ME-015), ME Rep. Wayne Farrin (D-ME-047), ME Speaker Ryan Fecteau (D-ME-132), ME Rep. Gary Friedmann (D-ME-014), ME Rep. Sharon Frost (I-ME-058), ME Rep. Drew Gattine (D-ME-126), ME Rep. Valli Geiger (D-ME-042), ME Rep. Traci Gere (D-ME-134), ME Rep. Cheryl Golek (D-ME-099), ME Rep. Anne ""Annie"" Graham (D-ME-105), ME Rep. Lori Gramlich (D-ME-131), ME Sen. Nicole Grohoski (D-ME-007), ME Rep. Tavis Hasenfus (D-ME-057), ME Rep. Allison Hepler (D-ME-049), ME Sen. Craig Hickman (D-ME-014), ME Sen. Henry Ingwersen (D-ME-032), ME Rep. Cassie Julia (D-ME-065), ME Rep. Christopher Kessler (D-ME-121), ME Rep. Amy Kuhn (D-ME-111), ME Rep. Michel ""Mike"" Lajoie (D-ME-096), ME Sen. Mark Lawrence (D-ME-035), ME Rep. Adam Lee (D-ME-089), ME Rep. Grayson Lookner (D-ME-113), ME Rep. Rafael Macias (D-ME-051), ME Rep. Marc Malon (D-ME-133), ME Rep. Anne-Marie Mastraccio (D-ME-142), ME Rep. Kristi Mathieson (D-ME-151), ME Rep. Parnell Terry (D-ME-108), ME Sen. Mike ""Michael"" Tipping (D-ME-008), ME Rep. Sophia Warren (D-ME-124), ME Rep. Kilton Webb (D-ME-098), ME Rep. Yusuf Yusuf (D-ME-118), ME Rep. Matt Moonen (D-ME-117), ME Rep. Kelly Murphy (D-ME-125), ME Sen. Tim ""Timothy"" Nangle (D-ME-026), ME Rep. Dani O'Halloran (D-ME-020), ME Rep. Laurie Osher (D-ME-025), ME Sen. Teresa Pierce (D-ME-025), ME Rep. William ""Bill"" Pluecker (I-ME-044), ME Rep. Dylan Pugh (D-ME-114), ME Sen. Joe Rafferty (D-ME-034), ME Rep. Ambureen Rana (D-ME-021), ME Sen. Cameron Reny (D-ME-013), ME Rep. Morgan Rielly (D-ME-127), ME Rep. Tiffany Roberts (D-ME-149), ME Rep. Amy Roeder (D-ME-023), ME Rep. David Rollins (D-ME-059), ME Rep. Walter ""Gerry"" Runte (D-ME-146), ME Rep. Melanie Sachs (D-ME-102), ME Rep. Suzanne ""Sue"" Salisbury (D-ME-128), ME Rep. Eleanor Sato (D-ME-109), ME Rep. Samuel ""Sam"" Zager (D-ME-116), ME Rep. Daniel ""Dan"" Sayre (D-ME-135), ME Rep. Daniel ""Dan"" Shagoury (D-ME-055), ME Rep. David Sinclair (D-ME-050), ME Rep. Charles Skold (D-ME-119), ME Rep. Holly Stover (D-ME-048), ME Rep. Laura Supica (D-ME-022), ME Sen. Rachel Talbot Ross (D-ME-028), ME Rep. Ann Matlack (D-ME-043), ME Rep. Julia McCabe (D-ME-093), ME Rep. Michele Meyer (D-ME-150), ME Rep. Nina Milliken (D-ME-016), ME Rep. Christina Mitchell (D-ME-110), ME Rep. Karen Montell (D-ME-054), ME Sen. Denise Tepler (D-ME-024)"
L.D. 1458 (S.P. 599): An Act Regarding Compensation Fees and Related Conservation Efforts for Solar and Wind Energy Development and High-impact Electric Transmission Lines Under the Site Location of Development Laws,Support,,Introduced or Prefiled,,"Accepted Majority (Ontp) Report,",https://legislature.maine.gov/billtracker/#Paper/SP0599?legislature=132,"This legislative amendment to Maine's Site Location of Development Laws revises the compensation fee program related to solar and wind energy developments and high-impact electric transmission lines. The amendment removes previous definitions of 'undeveloped land' and eliminates specific provisions regarding which wildlife habitats the Department of Environmental Protection (DEP) may consider when determining the adverse effects of renewable energy projects. Instead, it clarifies that the compensation fee program must fund conservation projects to offset the conversion of undeveloped land for renewable energy development. The compensation fees are intended to address all requirements for off-site habitat improvements or preservation, with explicit exceptions for habitats associated with rare, threatened, or endangered species; high and moderate value deer wintering areas; significant vernal pool habitats; high and moderate value waterfowl and wading bird habitats; and any other habitats classified as significant wildlife habitat under existing law. The amendment also stipulates that conservation projects funded by these fees must be located within the same biophysical region as the impacted development, unless otherwise approved by the DEP, and must involve habitat comparable to that affected by the project. The department is required to base its approval of conservation projects on the management priorities for the relevant biophysical region. No specific funding figures or deadlines are provided in the amendment, but a fiscal note is required. These changes align with the organization's mission to ensure that renewable energy development proceeds with appropriate environmental safeguards, particularly regarding habitat conservation, while clarifying the scope and limitations of compensation requirements.",ME Sen. Craig Hickman (D-ME-014),"ME Sen. Matt Harrington (R-ME-033), ME Sen. Jeff Timberlake (R-ME-017), ME Rep. Nathan Wadsworth (R-ME-082), ME Sen. Russell Black (R-ME-005)"
"L.D. 1083 (H.P. 705): Resolve, to Require the Department of Environmental Protection to Assess Existing Water Retention Structures and Water Levels",Support,,Introduced or Prefiled,,Final Disposition: Ought Not To Pass Pursuant To Joint Rule 310,https://legislature.maine.gov/billtracker/#Paper/HP0705?legislature=132,"Legislative Document No. 1083, introduced in the 132nd Maine Legislature, directs the Department of Environmental Protection to conduct a comprehensive assessment of water retention structures across the state, including dams. The assessment is to focus on identifying erosion issues and other impacts resulting from rising water levels. Additionally, the Department is tasked with evaluating water levels in lakes and ponds that are regulated by these retention structures. The legislation establishes a clear deadline, requiring the Department to submit a detailed report of its findings to the Second Regular Session of the 132nd Legislature by December 3, 2025. This resolve does not allocate specific funding or amend existing statutes, but it mandates a focused review of infrastructure and environmental conditions relevant to water management and climate resilience. The initiative aligns with environmental protection priorities by seeking to inform future policy decisions regarding water resource management and the mitigation of climate-related impacts.","ME Rep. Richard ""Rick"" Mason (R-ME-097)",
L.D. 1020 (S.P. 437): An Act to Repeal the Laws Providing for the Construction of a Connector to Gorham and to Resell Land Taken Under Those Laws to Previous Property Owners ,Support,,Introduced or Prefiled,,"Accepted Majority (Ontp) Report,",https://legislature.maine.gov/billtracker/#Paper/1020?legislature=132,"This legislative amendment to L.D. 1020, as proposed by the Maine Senate's Transportation Committee, revises the original bill by removing the requirement that the Maine Turnpike Authority must resell land acquired for the now-repealed Gorham connector project to previous property owners or their successors at the original purchase price, or transfer it to the municipality at no cost. The amendment changes the bill's title to reflect that it solely repeals the laws authorizing the construction of the connector to Gorham, without addressing the disposition of previously acquired land. No new funding allocations or deadlines are specified in this amendment. The key point is the elimination of mandated land resale or transfer provisions, which may impact property rights and municipal interests but aligns with a narrower focus on repealing the connector project authorization.",ME Sen. Stacy Brenner (D-ME-030),"ME Sen. Anne Carney (D-ME-029), ME Rep. Drew Gattine (D-ME-126), ME Rep. Kelly Murphy (D-ME-125), ME Rep. Laurie Osher (D-ME-025), ME Rep. Eleanor Sato (D-ME-109), ME Rep. Parnell Terry (D-ME-108), ME Rep. Sophia Warren (D-ME-124)"
"L.D. 1035 (H.P. 664): Resolve, to Study the Safe Disposal of Single-use Propane Canisters ",Support,,Introduced or Prefiled,,"Ought Not To Pass Pursuant To Joint Rule 310,",https://legislature.maine.gov/billtracker/#Paper/1035?legislature=132,"The legislative document from the 132nd Maine Legislature proposes a resolve to study the safe disposal of single-use propane canisters. The Department of Environmental Protection is tasked with examining the current disposal infrastructure and making recommendations for improvements to ensure safe disposal practices for residents. Additionally, the department will explore the feasibility of a statewide ban on non-refillable propane canisters. A report detailing the findings and recommendations is to be submitted by December 3, 2025, to the Joint Standing Committee on Environment and Natural Resources, which may propose related legislation in the Second Regular Session of the 132nd Legislature.",ME Rep. Ambureen Rana (D-ME-021),"ME Rep. Daniel ""Dan"" Ankeles (D-ME-100), ME Sen. Joe Baldacci (D-ME-009), ME Rep. Arthur ""Art"" Bell (D-ME-103), ME Sen. Nicole Grohoski (D-ME-007), ME Rep. Christopher Kessler (D-ME-121), ME Rep. Laurie Osher (D-ME-025)"
L.D. 1349 (S.P. 566): An Act to Require Legislative Approval for a Contract to Operate the Juniper Ridge Landfill,Support,,Introduced or Prefiled,,Final Disposition: Accepted Majority (Ontp) Report,https://legislature.maine.gov/billtracker/#Paper/SP0566?legislature=132,"This legislative amendment to Maine's Title 38, Section 2156-A, introduces a new requirement that the Department of Administrative and Financial Services, Bureau of General Services, must obtain majority approval from the state legislature before entering into or renewing any contract for the operation of the state-owned Juniper Ridge Landfill in Old Town. The amendment clarifies that this legislative approval is an additional step and does not replace any other licensing requirements mandated by law. The bill does not specify any new funding allocations or financial figures, but it does note that a fiscal note is required, indicating potential financial implications. No specific implementation deadlines or timelines are mentioned in the text. The key point of this amendment is to increase legislative oversight and public accountability regarding the management and operation of a significant state-owned waste facility, which aligns with environmental stewardship and transparent governance. This change is particularly relevant to organizations focused on environmental policy, public oversight, and responsible waste management, as it enhances the role of elected representatives in decisions affecting state-owned environmental assets.","ME Sen. Mike ""Michael"" Tipping (D-ME-008)","ME Sen. Rick Bennett (R-ME-018), ME Rep. David Boyer (R-ME-087), ME Rep. James ""Jim"" Dill (D-ME-026), ME Sen. Tim ""Timothy"" Nangle (D-ME-026), ME Rep. Amy Roeder (D-ME-023)"
L.D. 257 (S.P. 124): An Act to Eliminate the Practice of Net Energy Billing,Oppose,,Introduced or Prefiled,,Final Disposition: Ought Not To Pass Pursuant To Joint Rule 310,https://legislature.maine.gov/billtracker/#Paper/SP0124?legislature=132,"Legislative Document No. 257, introduced in the 132nd Maine Legislature, proposes the complete elimination of net energy billing (NEB) in the state. The bill repeals several sections of Maine law (notably 35-A MRSA §§3209-A, 3209-B, 3209-C, 3209-E, and related provisions) that previously authorized and regulated NEB programs, which allowed customers generating renewable electricity (such as from solar panels) to receive credits on their utility bills for excess energy supplied to the grid. The legislation explicitly prohibits the Public Utilities Commission from requiring transmission and distribution utilities to offer NEB to customers, effectively ending the practice statewide. Additionally, the bill amends property tax statutes (36 MRSA §§655 and 656) to remove exemptions for solar energy equipment that is used in conjunction with NEB, limiting such exemptions only to equipment where all generated energy is used on-site. The bill also makes conforming changes to other statutes to remove references to NEB and repeals related sales tax exemptions. No specific funding allocations or deadlines are included in the bill, but the changes would take effect for property tax years beginning on or after April 1, 2025. The key impact of this legislation is the cessation of state support for NEB, which may affect the financial incentives for residential, commercial, and institutional customers to invest in distributed renewable energy generation. This aligns with a policy shift away from NEB as a mechanism for promoting distributed renewable energy, potentially impacting organizations focused on renewable energy deployment, energy equity, and climate action in Maine.",,
L.D. 32 (S.P. 49): An Act to Repeal the Laws Regarding Net Energy Billing,Oppose,,Introduced or Prefiled,,"Carried Over, In The Same Posture, To Any Special Or Regular Session Of The 132Nd Legislature, Pursuant To Joint Order Sp 800.",https://legislature.maine.gov/billtracker/#Paper/SP0049?legislature=132,"Legislative Document No. 32, introduced in the 132nd Maine Legislature, proposes a comprehensive repeal of all state laws and regulations related to net energy billing (NEB). The bill eliminates the authority of the Public Utilities Commission (PUC) to establish or enforce NEB programs, which previously allowed utility customers to receive bill credits for electricity generated by their own or shared renewable energy systems, such as solar panels. Specifically, the bill repeals Title 35-A, sections 3209-A, 3209-B, 3209-C, 3209-D (in part), and 3209-E, which collectively governed the structure, eligibility, and operation of NEB for both residential and commercial customers. It also enacts a new section, 3209-F, explicitly prohibiting the PUC from requiring utilities to offer NEB to customers, thereby ending the practice statewide.

The legislation further amends related statutes to remove references to NEB, including those affecting property and real estate tax exemptions for solar energy equipment. Under the revised law, only solar energy equipment that uses all generated energy on-site will remain eligible for certain tax exemptions, eliminating benefits for systems participating in NEB or transmitting energy through utility infrastructure for off-site crediting. Additionally, the bill repeals a sales tax exemption for certain renewable energy equipment and makes technical changes to ensure consistency across Maine statutes by deleting or amending provisions that previously referenced NEB programs.

No specific funding allocations or financial figures are included in the bill, as its primary focus is regulatory repeal and statutory amendment rather than appropriations. The bill does not establish new deadlines for compliance but sets the effective date for tax-related changes to property tax years beginning on or after April 1, 2025. This timeline ensures that property owners and municipalities have clarity regarding the eligibility of solar energy equipment for tax exemptions in future tax years.

The key points of the bill are the full repeal of NEB programs, the prohibition of future NEB requirements by the PUC, and the narrowing of tax benefits to on-site solar energy use only. These changes significantly impact Maine's renewable energy landscape, particularly for organizations and individuals who have invested in or advocated for distributed solar and community energy projects. The bill aligns with a policy shift away from incentivizing customer-owned or shared renewable generation through utility bill credits, potentially affecting the growth of distributed renewable energy and related economic and environmental benefits in the state.

For organizations focused on advancing renewable energy access, distributed generation, and climate action, this legislation represents a substantial rollback of supportive policies. It may hinder efforts to expand solar adoption, reduce greenhouse gas emissions, and promote energy equity, as NEB has been a key mechanism for enabling broader participation in clean energy generation.",ME Sen. Stacey Guerin (R-ME-004),"ME Rep. Steven Foster (R-ME-032), ME Rep. Mathew McIntyre (R-ME-018), ME Rep. Katrina Smith (R-ME-062), ME Rep. Nathan Wadsworth (R-ME-082), ME Rep. James White (R-ME-030)"
L.D. 350 (S.P. 134): An Act Regarding the Operations of the Department of Inland Fisheries and Wildlife ,Support,,Introduced or Prefiled,,"Carried Over, In The Same Posture, To Any Special Or Regular Session Of The 132Nd Legislature, Pursuant To Joint Order Sp 800.",https://legislature.maine.gov/billtracker/#Paper/350?legislature=132,"The legislative document from the 132nd Maine Legislature, titled 'An Act Regarding the Operations of the Department of Inland Fisheries and Wildlife,' is a concept draft introduced by Senator Baldacci. The bill aims to propose amendments to the existing laws that govern the operations of the Department of Inland Fisheries and Wildlife. As a concept draft, it outlines the intention to modify current regulations but does not provide specific details or changes at this stage. The document was received by the Secretary of the Senate on January 30, 2025, and referred to the Committee on Inland Fisheries and Wildlife for further consideration.",ME Sen. Joe Baldacci (D-ME-009),
